{
  "schema_version": 1,
  "generated_at": "2026-09-24T20:00:00-03:00",
  "node": "fixture-warning",
  "summary": {
    "total": 1,
    "running": 1,
    "stopped": 0,
    "qemu": 1,
    "lxc": 0
  },
  "guests": [
    {
      "vmid": 100,
      "name": "fixture-vm",
      "type": "qemu",
      "status": "running",
      "template": false,
      "cpu": {
        "allocated": 2,
        "usage": 0.04
      },
      "memory": {
        "used_bytes": 536870912,
        "max_bytes": 1073741824
      },
      "storage": {
        "used_bytes": 2147483648,
        "max_bytes": 10737418240
      },
      "uptime_seconds": 3600
    }
  ]
}
